{
  "$schema": "./pricebook.schema.json",
  "$comment": "Machine source of truth for prices (built from docs/PRICEBOOK.md). Claude never invents a price: it picks codes, code computes totals. Change = PRICEBOOK.md + this file, approved by Meir; tools/pricebook_test.py diffs the two.",
  "version": "1.0",
  "updated": "2026-10-11",
  "currency": "USD",
  "rules": {
    "core_codes": [
      "RCP",
      "WEB",
      "BNDL"
    ],
    "one_core_offer_per_quote": true,
    "deposit_pct": 50,
    "deposit_rounding": "whole_dollars",
    "rush_pct": 25,
    "manual_price_setup_over_cents": 1000000,
    "quote_valid_days": 14,
    "discounts": {
      "FOUNDING": {
        "setup_pct": 30,
        "monthly_pct": 0,
        "max_clients": 3,
        "applied_by": "admin",
        "label": "Founding-client price"
      }
    },
    "monthly_discounts_allowed": false,
    "monthly_billing": "monthly in advance from the go-live date",
    "cancel_notice_days": 30,
    "liability_cap_months": 6,
    "liability_cap_floor_usd": 500,
    "included_usage": {
      "voice_minutes": 400,
      "sms_segments": 1000
    },
    "overage_markup_pct": 0,
    "custom_triggers": {
      "max_auto_locations": 3,
      "max_auto_voice_minutes_per_month": 3000,
      "hipaa_baa_requested": "custom",
      "ehr_or_practice_management": "custom"
    },
    "upwork_same_prices": true,
    "overage_policy": "no_auto_billing_alert_80_100_addon_with_approval"
  },
  "refund_rules": {
    "status": "final (standard-alignment pass 2026-10-12; no attorney review yet)",
    "deposit": {
      "refund_pct": 100,
      "window_days": 7,
      "window_from": "payment",
      "on_request": true,
      "condition": "client has not completed the access checklist",
      "text": "The setup deposit is fully refunded on request within 7 days of payment, as long as the access checklist has not been completed.",
      "label": "7-day refund"
    },
    "retainer": {
      "refund_pct": 75,
      "applies_to": "first_payment",
      "window_days": 7,
      "codes": [
        "RET-CARE",
        "RET-GROW",
        "RET-STUDIO"
      ],
      "text": "Retainers: 75% refund of the first payment if cancelled within 7 days."
    },
    "rcp_guarantee_days": 30,
    "rcp_guarantee": {
      "codes": [
        "RCP",
        "BNDL"
      ],
      "window_from": "go_live",
      "refunds": "setup_fee",
      "bundle_refunds": "rcp_setup_part",
      "monthly_fees_refunded": false,
      "service_after_refund": "switched_off",
      "not_for": "WEB keeps only the 7-day deposit rule: content work starts immediately",
      "label": "30-day satisfaction guarantee",
      "text": "30-day satisfaction guarantee: if you're not satisfied within 30 days after go-live, we refund the setup fee for the AI line and switch the line off. On the bundle, only the AI line's part of the setup fee is refunded and the website stays yours. Monthly fees for the period used are not refunded.",
      "legal": "If you are not satisfied within 30 days after go-live, tell us in writing (email or the portal) and we will refund the setup fee you paid for the AI Receptionist and switch the AI line off. On the Receptionist + Website bundle, we refund only the AI Receptionist part of the setup fee: the AI Receptionist's stand-alone setup price, less the same percentage discount (if any) you received on the bundle. The website stays yours, and its monthly plan continues unless you cancel it. Monthly fees for the period used are not refunded. This applies to the AI Receptionist and the bundle, not to the website on its own."
    }
  },
  "items": [
    {
      "code": "RCP",
      "name": "Missed-Call AI Receptionist",
      "group": "core",
      "kind": "fixed",
      "setup_cents": 350000,
      "monthly_cents": 30000,
      "applies_to": [],
      "delivery_business_days": 10,
      "delivery_starts": "after access is complete",
      "marketed": true,
      "includes": [
        "1 location, 1 AI line (a US number we provision; you keep your existing number and forward unanswered calls to it)",
        "Voice answering of missed and forwarded calls, plus an automatic text-back to callers who hang up",
        "Collects job details: name, callback number, service address/ZIP, job type, urgency, preferred time",
        "Booking into 1 calendar: Google Calendar or Calendly",
        "Up to 25 FAQ entries, business hours, after-hours mode, emergency keywords with an owner alert",
        "Owner notifications by SMS and email for every lead, plus a daily summary email",
        "1 outgoing Zapier webhook (lead and booking events) to connect any other tool",
        "English. Client portal with call log, transcripts, bookings and settings",
        "A2P 10DLC SMS registration handled by us (registration fees included)",
        "Included usage per month: 400 voice minutes and 1,000 SMS segments; alerts at 80% and 100%; no automatic overage billing, extra usage blocks added only with your approval",
        "Monthly: monitoring, prompt/FAQ updates, 1 active change request at a time (small changes, up to 1 hour each)"
      ],
      "excludes": [
        "Outbound AI calls and marketing text messages",
        "Additional locations or AI lines (add-on ADD-LOC)",
        "Spanish / bilingual line (add-on ADD-ES)",
        "Native CRM/FSM integrations (add-on ADD-CRM)",
        "Website chat widget (add-on ADD-CHAT)",
        "Usage above the included 400 minutes / 1,000 texts (we alert you at 80% and 100%; extra usage blocks only with your approval)",
        "Call audio recording (calls are transcribed; audio is not stored)",
        "Handling of medical records or other protected health information (no HIPAA BAA)"
      ]
    },
    {
      "code": "WEB",
      "name": "Business Website (template-based, 5 pages)",
      "group": "core",
      "kind": "fixed",
      "setup_cents": 190000,
      "monthly_cents": 12900,
      "applies_to": [],
      "delivery_business_days": 7,
      "delivery_starts": "after content is complete",
      "marketed": true,
      "direct_checkout": true,
      "includes": [
        "5 pages (Home, Services, About, Reviews/FAQ, Contact), mobile-first, fast static hosting, SSL",
        "Lead form to email and Google Sheet; click-to-call and click-to-text buttons",
        "Basic local SEO: titles/meta, LocalBusiness schema, sitemap, Google Search Console and Google Business Profile link",
        "Copywriting from your questionnaire (AI-drafted, approved by you), stock or your own photos",
        "Monthly: hosting, uptime check, 1 small content edit per month"
      ],
      "excludes": [
        "Pages beyond the 5 included (add-on ADD-PAGE)",
        "Spanish version of the website (add-on ADD-WEB-ES)",
        "Logo design (add-on ADD-LOGO)",
        "Blog section and articles (add-on ADD-BLOG)",
        "Ongoing SEO campaigns and paid advertising",
        "More than 1 small content edit per month"
      ]
    },
    {
      "code": "BNDL",
      "name": "Receptionist + Website bundle",
      "group": "core",
      "kind": "fixed",
      "setup_cents": 490000,
      "monthly_cents": 40000,
      "applies_to": [],
      "delivery_business_days": 14,
      "delivery_starts": "after access and content are complete",
      "marketed": true,
      "contains": [
        "RCP",
        "WEB"
      ],
      "includes": [
        "Everything in the Missed-Call AI Receptionist (RCP)",
        "Everything in the Business Website (WEB)",
        "Your AI line number on the website",
        "Web chat widget on the website (same AI brain) included"
      ],
      "excludes": [
        "Outbound AI calls and marketing text messages",
        "Additional locations or AI lines (add-on ADD-LOC)",
        "Spanish / bilingual line (add-on ADD-ES)",
        "Native CRM/FSM integrations (add-on ADD-CRM)",
        "Usage above the included 400 minutes / 1,000 texts (we alert you at 80% and 100%; extra usage blocks only with your approval)",
        "Call audio recording (calls are transcribed; audio is not stored)",
        "Handling of medical records or other protected health information (no HIPAA BAA)",
        "Pages beyond the 5 included (add-on ADD-PAGE)",
        "Spanish version of the website (add-on ADD-WEB-ES)",
        "Logo design (add-on ADD-LOGO)",
        "Blog section and articles (add-on ADD-BLOG)",
        "Ongoing SEO campaigns and paid advertising",
        "More than 1 small content edit per month"
      ]
    },
    {
      "code": "ADD-LOC",
      "name": "Additional location / AI line",
      "group": "addon",
      "kind": "fixed",
      "setup_cents": 90000,
      "monthly_cents": 10000,
      "applies_to": [
        "RCP"
      ],
      "includes": [
        "1 more location with its own AI line, hours and FAQ"
      ],
      "excludes": []
    },
    {
      "code": "ADD-ES",
      "name": "Spanish (bilingual line)",
      "group": "addon",
      "kind": "fixed",
      "setup_cents": 75000,
      "monthly_cents": 5000,
      "applies_to": [
        "RCP"
      ],
      "includes": [
        "Callers can speak or text in Spanish; summaries to you stay in English"
      ],
      "excludes": []
    },
    {
      "code": "ADD-CRM",
      "name": "Native CRM/FSM integration, per system (Jobber, Housecall Pro, GoHighLevel, HubSpot)",
      "group": "addon",
      "kind": "fixed",
      "setup_cents": 120000,
      "monthly_cents": 5000,
      "applies_to": [
        "RCP"
      ],
      "per": "system",
      "includes": [
        "Leads and bookings written directly into 1 supported system (Jobber, Housecall Pro, GoHighLevel or HubSpot)"
      ],
      "excludes": [
        "Systems not listed here (quoted as custom)"
      ]
    },
    {
      "code": "ADD-CHAT",
      "name": "Website chat widget (same AI brain)",
      "group": "addon",
      "kind": "fixed",
      "setup_cents": 50000,
      "monthly_cents": 2500,
      "applies_to": [
        "RCP"
      ],